Id,PostId,Score,Text,CreationDate,UserDisplayName,UserId
"83083833","48055708","0","@SlowSloth, this is just one of those things in Python. If you declare an object **once** outside the loop, that is just **one** object. That's why when you print it, is prints the same object 3 times. Whereas if you create the object in the loop, you create a new object each iteration. Unless you don't want to ever modify `new_alien`, declaring it outside the loop is fine. Otherwise, your asking for trouble.","2018-01-02 05:04:22","","5238915"
"83083836","48055752","0","For now, we can safely assume the delimiters themselves (`[` and `]`) will never appear in the tokens. If that ever is a need, I could probably work from that point to implement a way to properly handle the escaped delimiters. If the string `[[This is a string]]` appears, it should become one token, as is. If `[ ]` is found, it should be added as a token of three chars. A closing `]` can always be assumed to be the end of an escaped token Extra `]`'s can be ignored and treated as normal chars. In fact, the `]` will always be at the end of a token.","2018-01-02 05:04:32","","2340285"
"83083838","48055789","0","unfortunately, sudo isn't recognized as a command. I've also used the terminal with Admin privileges to no avail.","2018-01-02 05:04:47","","9162329"
"83083839","48055778","0","have look [UriMatcher](https://stackoverflow.com/a/26901852/5110595)","2018-01-02 05:04:55","","5110595"
"83083840","48055548","0","thx ur answer.I wrote ur codes,but it did not work.detail.html does not show anything.when I print out print(content) in detail method, it does shown only title(I think content has title&text).But I can know content 's value can be gotten.But when I wrote `<h2>{{ content }}</h2>` in detail.html,nothing is shown.How should I fix this?","2018-01-02 05:04:55","","7676799"
"83081032","48054281","0","Glad, it helped you!","2018-01-02 00:27:38","","4325010"
"83081034","48049787","1","If it is not what you want take a look to the modules `report_xls` and `report_xlsx`. They will give you some idea","2018-01-02 00:27:58","","4891717"
"83081036","48054294","0","Hmm tried that too @Nkosi, `[RoutePrefix(""api/resize"")]` and `[HttpPost, Route(""preserveAspectRatio"")]` and am getting the same error, `""MessageDetail"": ""No type was found that matches the controller named 'resize'.""`","2018-01-02 00:27:58","","6305105"
"83081037","48029563","0","The only problem is that it doesn't print any model fit measures now. If I add the argument ""chi"" it prints error: unknown argument 'chi'. Is there a way to print any fit indices at all? I couldn't find anything...","2018-01-02 00:28:01","","4744854"
"83081038","48054284","0","Can you explain why you want to use a table in your HTML, but yet not display your data in normal tabular form? Because what you are trying to do would be much easier if you just don't use tables, unless there is some underlying reason why you have to use them.","2018-01-02 00:28:01","","8588454"
"83081039","48052876","0","Oh, ok, I'm just kinda newbie here...","2018-01-02 00:28:06","","9161360"
"83081040","17378420","0","thx it helped me remove some ""spam malware plugin""","2018-01-02 00:28:06","","1347601"
"83081042","48051226","0","Thanks Henrik -- that's helpful. PS. Why was the question marked off-topic? I could add code for a few of the operations that don't preserve dates, but I doubt it would improve the question.","2018-01-02 00:28:19","","5596077"
"83081043","48053836","0","I've updated the original post to include the entire .js file for the Alexa skill. Thanks so much for your help!!","2018-01-02 00:28:32","","9154925"
"83081045","36461397","1","Also note that while the replacement is technically atomic, if somebody is doing a multipart download of an object (e.g. `aws s3 cp` with default arguments) at approximately the same time as you replace it, they may receive multipart chunks from *different* versions of that file. This can lead to the downloaded file being a mix of both files (and probably very corrupted); see e.g. [this GitHub issue](https://github.com/aws/aws-cli/issues/2321).","2018-01-02 00:28:43","","612279"
"83081050","48054324","0","You need to format this question to differentiate the error messages you are getting from the body of your question. Please review the documentation: https://stackoverflow.com/help/how-to-ask","2018-01-02 00:28:59","","6719819"
"83081051","16888490","1","ApplicationContext .get() no longer exists. https://docs.spring.io/spring-framework/docs/current/javadoc-api/org/springframework/context/ApplicationContext.html  What would be the new way to do this?","2018-01-02 00:29:02","","1967416"
"83081052","48054346","0","1. Is [Template Literals](https://developer.mozilla.org/en-US/docs/Web/JavaScript/Reference/Template_literals) (new(er) feature). 2. See 1.","2018-01-02 00:29:17","","2679750"
"83081053","5394213","0","i get the error  'TypeError: initial_value must be str or None, not bytes'  when trying to use your line msg = email.message_from_string(j)","2018-01-02 00:29:21","","4454657"
"83081056","48054321","0","I use the function whichever gives me **unique** locator for the element! You might want to take a look at this page - http://elementalselenium.com/tips/32-xpath-vs-css, gives you performance stats.","2018-01-02 00:29:32","","1946418"
"83081057","48054277","0","you might want to know which element didn't exist somehow and throw that as part of the exception, if its not done already.","2018-01-02 00:29:37","","9086466"
"83081059","48054201","1","Possible duplicate of [Drag an annotation pin on a mapview](https://stackoverflow.com/questions/10733564/drag-an-annotation-pin-on-a-mapview)","2018-01-02 00:29:55","","1361672"
"83081060","48052884","1","You should study the excellent answer to [this question](https://networkengineering.stackexchange.com/q/7106/8499). It explains how network addressing works, and you should be completely familiar with that before attempting such an endeavor. Network addresses are 32-bit binary numbers.","2018-01-02 00:30:03","","3745413"
"83083367","48055425","0","@lopu There is no ""memory"" in the ""C stack"" sense in JavaScript. The language operates at a different level of definition and implementation. So no, it's *not possible* to ""overwrite memory"" excepting as it's possible to re-assign *properties* (and properties are not variables!) of objects. There are *closures* in JavaScript (that is, a variable that has been ""closed over"" can be re-assigned within it's defined scope), but that's a different issue and has *no effect* on function arguments/parameters.","2018-01-02 04:23:14","","2864740"
"83083368","48040204","0","@JasonB I did it with your way thanks a lot","2018-01-02 04:23:16","","9110929"
"83083369","48052968","0",">1
That does not work anymore (with swift 4.0 and Mac OS 10.13.2 atleast). This is for my local development and not production.

>2
Setting NSAllowsLocalNetworking relaxes SSL strictness only for local host access and not any other server.

>3
I cannot get a certificate for localhost with letsencrypt, can I ? Creating a new CA will be too complex if I just want to focus on local development in my laptop. Are there any potential vulnerabilities that I am missing by setting the NSAllowsLocalNetworking ? I am not able to find any such by reading that docs. Do I miss something ? Thanks.","2018-01-02 04:23:36","","153586"
"83083371","47843025","0","Is that true of sets as well?","2018-01-02 04:24:14","","1712447"
"83083372","48054282","1","rerun the serve command","2018-01-02 04:24:14","","8437740"
"83083376","48055452","0","i am not trying to access my node server. i am trying to access a django service outside the docker container.
i run the command docker run -p 11777:11777 and the django service runs on 127.0.0.1:8000","2018-01-02 04:24:30","","9162218"
"83083377","48001577","0","@Marco13 , the rows are columns of the matrices are given as input parameters to the function. So , we , and the program are sure that the rows are gonna be ""m"" and columns are gonna be ""n"". The only issue is wrt the order. In my question , I assumed dense matrix to be of row major , whereas the reality is dense matrices are of column major. My question had pre-assumed that rows n columns are 4 & 5 respectively. Sorry that I didnt mention them explicitly. :)","2018-01-02 04:24:30","","6644257"
"83083378","48033967","2","This is still unclear. why is n is 19 and k is 3 does it make the 16th node the one? 19%3 is 1, not 0?","2018-01-02 04:24:34","","1294207"
"83083379","48022729","0","@Veeram, Okay let me check. Thanks! :)","2018-01-02 04:24:43","","6443951"
"83083380","48055014","0","So, this is the issue, you did not install the `urllib3 ` in your current python interpreter.","2018-01-02 04:24:50","","6523163"
"83083381","48054765","0","Learn what `if else` is about. Better yet, if a `switch` statement is giving *you* the result you claim, give us the **full** code to reproduce it instead of  *""(the code for when random is aardvark)""*. It's extremely likely that `random != ""aardvark`, which would be why your default is executing.","2018-01-02 04:24:58","","7014451"
"83083382","48055369","0","Ive updated my question. I actually send it as a form","2018-01-02 04:24:59","","8646746"
"83083383","48055367","0","@user2864740 I know that which is why you can reassign properties of variables which affects the variable globally, but you can't change the actual variable memory globally.

I mean you could loop over and delete all properties, and then loop over all the properties of your new object and `Object.assign` them but that only works with objects, you can't turn an object into an array, or an object into a number, or really anything else","2018-01-02 04:25:00","","5604313"
"83083385","48013648","0","Did you check whether data has been deleted from the data explorer of the management console?  Could you please share the  analytics-config.xml file at  <DAS_HOME>/repository/conf/analytics/  directory ?","2018-01-02 04:25:15","","1101345"
"83081883","48054732","3","Consider returning a redirect result (following the PRG pattern) `return RedirectToAction(""Index"");`","2018-01-02 01:55:40","","40521"
"83081884","48054671","0","@dmitryro Yes, but do you think that using this module is better than using allauth? Instead of using allauth and re-configuring it to my expectations?","2018-01-02 01:55:40","","5209769"
"83081885","48050289","0","Software recommendations are off-topic on Stack Overflow.  Go to https://softwarerecs.stackexchange.com/ instead.","2018-01-02 01:55:50","","1944004"
"83081887","48054671","0","Activation logic is not part of it - it's a custom feature you're implementing yourself - registration_api module with Django Rest Framework has similar logic for providing activation tokens https://github.com/alej0varas/django-registration-rest-framework all you need is to generate this token and send it via email.","2018-01-02 01:55:59","","3358074"
"83081888","48054710","0","Can you create a sql fiddle for us","2018-01-02 01:56:11","","1004589"
"83081889","48054696","0","See my comment in main thread.  You need to model this with (toy) physics.  Your pull towards the middle is right enough in the absence of a force, but your pull away is wrong.","2018-01-02 01:56:19","","1364723"
"83081890","48045608","0","@DanGetz I understand. Thank you very much.","2018-01-02 01:56:28","","7313239"
"83081892","48054284","0","If you override the default layout of tables, don't expect things like colspan to work correctly. I suggest you rethink how your layout should be structured. If it doesn't conform to normal table structure, don't use HTML tables","2018-01-02 01:56:39","","303502"
"83081894","48054671","0","Have implemented it myself - pretty straightforward. You can give a try to both if you want, but process is similar, it's more about configuring things properly.","2018-01-02 01:56:55","","3358074"
"83081895","48054506","0","It's not usually true that you need *all* the data and indexes to fit in RAM. InnoDB is designed to keep the most frequently-used pages in RAM. At my company, we tend to have a general rule that the InnoDB buffer pool is configured to about 1/10th the size of the database (data + indexes). In some cases we might adjust this up or down, but it's a good starting point.","2018-01-02 01:57:05","","20860"
"83081896","20465626","0","@Buda Florin, so true. SQLite support in EF6 is just awful. If you want to have something else than just a code-first model (e.g. migrations) - it's pain. What makes it worse is EFCore and SQLite seems to work just great - which implies that they not going to improve EF6-SQLite combination. I started to look at Compact even though it is abandoned.","2018-01-02 01:57:10","","4069781"
"83081897","48054513","0","It’s a topic a Haskell programmer definitely will want to get to, at some point, but maybe a little too far off on a tangent for this question? That’s very true, and why I said “more than one type,” rather than any type.","2018-01-02 01:57:13","","4474419"
"83081898","48053370","0","Thank you!! Works like a charm! I am in complete awe as to how much Rcpp/RcppArmadillo has sped up my algorithm! It is a great package indeed!","2018-01-02 01:57:20","","8183972"
"83081899","48031749","0","@ljanssen, you could search about MVVM, why this design mode take advantages.","2018-01-02 01:57:23","","5620055"
"83081900","44642550","0","Did you solve your problem?","2018-01-02 01:57:29","","1122976"
"83081901","48052015","0","@LuisA.Florit: Then set up your `<intent-filter>` to only accept `file` as a scheme, if you can only deal with files. Or remove the limitation that you need a filename. Or use `DocumentFile` to get the ""display name"" and work with that, as occasionally that will actually be a traditional filename.","2018-01-02 01:57:40","","115145"
"83081902","48054299","0","'USART_Write(USARTx,&c);'......'while(*str)' - NO!  Single chars are not NUL-terminated char arrays!","2018-01-02 01:57:49","","758133"
"83081903","48039487","0","I'm getting closer - I know I need to use Function Mode: https://router.vuejs.org/en/essentials/passing-props.html#function-mode

But I'm not sure how to use Function mode with a route that has multiple components.","2018-01-02 01:57:54","","1854078"
"83081904","48054495","1","Generally speaking, it the time is, for example, 1514857893.927648 (where 1514857893 represents 2018-01-02 01:51:33 +00:00) , then `time()` will return the integer part with no rounding — 1514857893.  This is not mandated by the C standard; POSIX [`time()`](http://pubs.opengroup.org/onlinepubs/9699919799/functions/time.html) says: _The time() function shall return the value of time [CX] ⌦  in seconds since the Epoch. ⌫_","2018-01-02 01:58:10","","15168"
"83081905","48054694","2","The error indicates that `this.passedData` is null. Are you sure that `clearPassedData` is not called before `pushPassedData`?","2018-01-02 01:58:13","","1009922"
"83081906","48054731","0","Can you clarify more, your title is **failed to upload ...** but in your description, you mentioned that file is uploaded, please be consistent.","2018-01-02 01:58:14","","3389795"
"83081908","48054713","0","I like this solution, but it assumes that there are only 2 rows with 'NW' in the 'a' column. Do you know if there's a way to do this in one line without having to hard-code the first value (2) in `reshape()`?","2018-01-02 01:58:26","","3474397"
"83081909","48054723","0","If you inspect the element in your browser, you'll see it starts off without an href attribute (or just look at how you defined the source).  After you click it the first time, you are setting the href on it.  It then knows where to go for the second click.","2018-01-02 01:58:28","","1586174"
"83081910","48054688","0","Both answers below are correct, depending on what flexibility you have in whether you must have `savePost()` or not within the `for`loop. Make sure you check one of them off as the answer.","2018-01-02 01:58:28","","6719819"
"83081911","9105305","0","Is there any consensus on whether this code is still faster? I'm getting a Guid comparison performance problem, and I'm investigating options, but I'm using the latest version of .NET so I'm wondering if the old issue is still relevant.","2018-01-02 01:58:33","","1878141"
"83081912","48054696","0","Im trying to make sense of it. How do I turn the mouse position into an acceleration?","2018-01-02 01:58:35","","5280885"
"83081913","48054671","0","@dmitryro What was the reason for you to not use allauth though?","2018-01-02 01:58:34","","5209769"
"83081916","48036848","0","@RichardButterwood The port 5162 is running on Azure VM? Could you tcping this port on your local?","2018-01-02 01:58:50","","6997262"
"83081919","48051521","0","@ikegami: The output is something that I edited into the question. It's the result of running the code that the OP shows.","2018-01-02 01:59:23","","622310"
"83081920","48054723","0","jquery is in my code.  look at the fiddle it is already referencing it.  I didn't update the question with the code snippet, you did, which the snippet doesn't allow library additions.","2018-01-02 01:59:25","","5225334"
"83081923","48040363","1","Hi! That's an interesting solution you've come with. Is the error `Cannot find module './reducers/activities'` produced by typescript or node? Probably the first one, because typescript doesn't `understand` importing when types don't exist for imported modules. In this case I usually just `require` them the node style or write typings, which is you create index.d.ts (will update the answer now)","2018-01-02 01:59:27","","4598587"
"83081925","48054751","0","`\leq` represents *non-HTML source markup* (TeX-ish?) but it will not be *rendered* as a `<` in an HTML document. The OP probably wishes the `<` to be rendered as such to represent the (non-HTML source) markup graphically.","2018-01-02 01:59:40","","2864740"
"83083843","48053226","0","If the problem is solved, I suggest deleting the question. There’s no answer and it probably doesn’t have long-term benefit to other people.","2018-01-02 05:04:56","","15168"
"83083844","38978452","0","Its resolved by this way. This can be done by calling json request in some interval of time and checking whether the download is completed or not. If download gets completed, a value can be set to request or session and this json request fired in regular intervals check whether that request or session value is available. If available json requests stops and mention as download complete. But this method reduces the performance","2018-01-02 05:04:56","","2995123"
"83083845","48055711","0","Have you tried the code exactly as I wrote it? What PHP version are you using? Have you denied cookies in your browser?","2018-01-02 05:05:03","","5042856"
"83083846","48055670","0","Have you tried by $(this).append($(stringDir)); ? Because 'stringDir' is just a string until you wrap up with $().","2018-01-02 05:05:04","","7289067"
"83083847","48029305","0","Maybe you should just create 3 of these below each other: https://owlcarousel2.github.io/OwlCarousel2/demos/responsive.html, and make them move at the same time. Would that be a solution?","2018-01-02 05:05:04","","2397550"
"83083848","48055785","1","In the OP's case 'self.value' was defined in the 'Derived', so the Base class doesn't know about it.","2018-01-02 05:05:12","","1767754"
"83083851","48055472","0","Hello Ivan, Thank you for you answer. I have compared the parameters you have got using the least square approximation. I compared these parameters with the required one and found that these are very rough approximation. Will it be better to use optimize.minimize function in scipy for this approach? I have updated the question with the actual K_P matrix and vectors (X and f). I was finding it difficult to put the equality constraint so that at the final optimized parameter values the error function should be minimum (K_P*X-f) or zero.","2018-01-02 05:05:18","","8004700"
"83083852","4054234","1","The link is now broken.","2018-01-02 05:05:20","","1377770"
"83083853","48055742","0","I have updated answer with join solutions, but it is a little complicated. One more thing no need to `group by p.id` if table `product_attribute` doesn't have duplicate (product_id, attribute_id, attribute_value_id)","2018-01-02 05:05:22","","5989431"
"83083857","48055564","0","thx ur answer.I wrote ur codes,but it did not work.detail.html does not show anything.when I print out print(content) in detail method, it does shown only title(I think content has title&text).But I can know content 's value can be gotten.But when I wrote `<h2>{{ content }}</h2>` in detail.html,nothing is shown.How should I fix this?","2018-01-02 05:05:42","","7676799"
"83083860","48055499","0","Besides the questionable part where you want to start 10K dd processes, this is exactly what I had in mind. I finally posted an answer, and +1 to you.","2018-01-02 05:05:54","","2988730"
"83083861","48055747","0","see this : https://jonathanbossenger.com/building-your-own-divi-builder-modules/ ,    https://divi.space/blog/adding-custom-modules-to-divi/","2018-01-02 05:05:59","","8557766"
"83083862","48051950","0","This worked well. The only thing I had to change was `chart.tooltip.contentGenerator` to `chart.interactiveLayer.tooltip.contentGenerator`, without it the console was shooting an error of `contentGenerator` is undefined. More likely an error caused by my setup and all documentation I have now found points for your solution. Thanks again.","2018-01-02 05:06:03","","8450582"
"83083864","48055813","0","You didn't pass the parameter jsonObject in your getApp method","2018-01-02 05:06:11","","3789993"
"83083865","46417771","0","I do not know why your comment was downvoted, both your solution and Omar's resolve the issue. I'm upvoting you to offset whatever grinch poopood on you.","2018-01-02 05:06:12","","1780027"
"83081062","48054313","0","You can also use Javascript Arrays to help.  Pure Javascript is much faster than a javascript library.  Here is an example[Javascript Array](https://fiddle.jshell.net/NitroXAce/d1qro5g3/18/).","2018-01-02 00:30:08","","4892181"
"83081065","48027502","0","Sorry, my bad. Did not think enough about the code. Because it is unclear, which file can't be found, you may do a `ls -l xreflist` before, a `ls -l $line` in the loop and a `ls -l resutl3.txt`after the loop. Or add proper error handling `if [ ! -r $line ]; then echo ""$line not readable""; continue; fi`","2018-01-02 00:30:15","","6535641"
"83081066","48053790","0","The value on the stack corresponding to `$4` (for example) was created when the first `AffectationI` was reduced (which is long before the second one was reduced). If you don't want that to happen, you need to rethink your semantic actions. Probably you want to build a parse tree rather than evaluate as you go.","2018-01-02 00:30:20","","1566221"
"83081071","38773353","0","Thanks for this, I was worried I had to duplicate the parameter from the parameters file to the twig globals.","2018-01-02 00:30:49","","1419358"
"83081072","48050361","0","@TemaniAfif I'm sorry. I'm not good at English, So I think I used the inappropriate word. `It doesn't allow using duplicated ID Selector` means `It's not standard`. That's it.","2018-01-02 00:30:50","","8437099"
"83081073","48054329","0","but the user register on the website then verify  his email  Before he could sending .... mean he use his own email not ""impersonate""
but how to create that ???","2018-01-02 00:30:57","","7757116"
"83081074","48054146","1","Yeah, `componentWillMount()` only fires once when the screen is initially loaded (not shown).","2018-01-02 00:31:05","","2232413"
"83081076","48054066","0","it just has one column. The words in the string are seperated with a pipeline symbol","2018-01-02 00:31:11","","9158922"
"83081077","33294084","0","FYI, the [Joda-Time](http://www.joda.org/joda-time/) project is now in [maintenance mode](https://en.wikipedia.org/wiki/Maintenance_mode), with the team advising migration to the [java.time](http://docs.oracle.com/javase/9/docs/api/java/time/package-summary.html) classes. See [Tutorial by Oracle](https://docs.oracle.com/javase/tutorial/datetime/TOC.html).","2018-01-02 00:31:29","","642706"
"83081079","48049837","1","@user8: So essentially you are saying to count the zeros (the number of elements flipped from the initial 1 and not flipped back). How is that simpler than counting the ones?","2018-01-02 00:31:42","","298225"
"83081080","48053614","1","hey @Brent, are you using a bodyParser.urlencoded ?","2018-01-02 00:32:01","","9157407"
"83081083","45589068","0","How would be be loaded in an overlay on top of my form, for instance? Thanks","2018-01-02 00:32:38","","3230040"
"83081085","48046951","0","$result is a string when one result and array if many. You should either make if(is_array) or refactor the function to return consistent results.. is that some framework?","2018-01-02 00:32:43","","554575"
"83081088","48054167","0","ConnorsFan, I tried your pointers but failed at it. Then bite the bullet and developed a more complex solution and the challenge is now over. I basically turn the div to `<div>{{badgeCountForPanel[i]}}</div>` and then build a solution at the ts which keeps the badgeCountForPanel array correct all the time. That did the trick. Nw I'm trying to make this badgeCountForPanel multidimensional so I can have this: `badgeCountForPanel['panelGroup1'][i]` (this way, it's possible to have  one global var & multiple panelGroups on the same page. Challenge now stepped up but I know how to kill it. ThankYou","2018-01-02 00:33:07","","1017513"
